filename,onset,offset,speaker,phonemes
sub-J4J6X7C4D9_ses-02_task-other_run-01_audio__0d082242ef4d7ca6b9b9a9382fb0f323.wav,0.12,0.56,KCHI,l ɔ p
sub-J4J6X7C4D9_ses-02_task-other_run-01_audio__0d082242ef4d7ca6b9b9a9382fb0f323.wav,1.36,4.56,KCHI,a t i t ɪ t ø ɛ n ə t a
sub-J4J6X7C4D9_ses-02_task-other_run-01_audio__0d082242ef4d7ca6b9b9a9382fb0f323.wav,4.88,11.94,KCHI,w i a j ə ɔ m ə æ m a t w i a j ʊ h æ m ɪ n æ m ɪ ɛ n ə h a t ʒ i
sub-J4J6X7C4D9_ses-02_task-other_run-01_audio__0d082242ef4d7ca6b9b9a9382fb0f323.wav,12.52,27.86,KCHI,k ʌ m a k ə k ʌ m ə k ə w i a l h ɛ n ə n ɔ m h a n ə n ə h a t ʃ i t ʒ y b ɔ k ə b ʊ k w e l o ʊ h ɪ n ə n a m h a n ə m a h a t ʃ i t ʒ i ʃ a m ə ʃ a m e b i a
sub-J4J6X7C4D9_ses-02_task-other_run-01_audio__0d082242ef4d7ca6b9b9a9382fb0f323.wav,31.84,39.8,KCHI,ɔ k h ɔ k w i a j ɔ w a h a n a n a m d a m a t y d ə
